{
  "$id": "https://aip.org/schemas/event-interaction-started.json",
  "$schema": "https://json-schema.org/draft/2020-12/schema",
  "title": "InteractionStartedEvent",
  "description": "Lifecycle event fired when the user starts interacting with a commercial response.",
  "type": "object",
  "required": [
    "event_type",
    "serve_token",
    "session_id",
    "platform_id",
    "agent_id",
    "wallet_id",
    "settlement",
    "ts"
  ],
  "properties": {
    "event_type": {
      "type": "string",
      "const": "interaction_started",
      "description": "Lifecycle event type identifier.",
      "example": "interaction_started"
    },
    "serve_token": {
      "type": "string",
      "description": "Serve token from the PlatformResponse. Used to stitch exposure, interaction, delegation, and outcome events.",
      "example": "stk_abcxyz123"
    },
    "session_id": {
      "type": "string",
      "description": "Session identifier from platform_request.",
      "example": "sess_001"
    },
    "platform_id": {
      "type": "string",
      "description": "Platform generating the click event.",
      "example": "pf_openai_chat"
    },
    "agent_id": {
      "type": "string",
      "description": "Winning brand agent or advertiser identifier.",
      "example": "ba_451"
    },
    "wallet_id": {
      "type": "string",
      "description": "Wallet to charge for this interaction.",
      "example": "w_0021"
    },
    "settlement": {
      "type": "object",
      "required": ["unit", "amount_micros", "currency"],
      "properties": {
        "unit": {
          "type": "string",
          "enum": ["CPC", "CPE"],
          "description": "Settlement unit for this event.",
          "example": "CPC"
        },
        "amount_micros": {
          "type": "integer",
          "minimum": 0,
          "description": "Charge amount in micros as defined by the brand agent's bid.",
          "example": 450000
        },
        "currency": {
          "type": "string",
          "pattern": "^[A-Z]{3}$",
          "description": "Currency code.",
          "example": "USD"
        }
      },
      "additionalProperties": false
    },
    "interaction_metadata": {
      "type": "object",
      "description": "Optional details about the interaction.",
      "properties": {
        "source": {
          "type": "string",
          "enum": ["deep_link", "button", "voice_confirmation", "agent_action"],
          "description": "How the interaction occurred.",
          "example": "deep_link"
        },
        "position": {
          "type": "integer",
          "minimum": 1,
          "description": "Position in result list (if relevant).",
          "example": 1
        }
      },
      "additionalProperties": false
    },
    "ts": {
      "type": "string",
      "format": "date-time",
      "description": "ISO 8601 timestamp when the interaction occurred.",
      "example": "2025-11-14T18:00:02Z"
    },
    "ext": {
      "$ref": "./common.json#/definitions/extensionNamespace"
    }
  },
  "examples": [
    {
      "event_type": "interaction_started",
      "serve_token": "stk_abcxyz123",
      "session_id": "sess_001",
      "platform_id": "pf_openai_chat",
      "agent_id": "ba_451",
      "wallet_id": "w_0021",
      "settlement": {
        "unit": "CPC",
        "amount_micros": 450000,
        "currency": "USD"
      },
      "interaction_metadata": {
        "source": "deep_link",
        "position": 1
      },
      "ts": "2025-11-14T18:00:02Z"
    }
  ]
}
