{
  "event_type": "interaction_started",
  "serve_token": "stk_valid_001",
  "session_id": "sess_001",
  "platform_id": "openai_chat",
  "agent_id": "brand_agent_123",
  "wallet_id": "wallet_123",
  "settlement": {
    "unit": "CPE",
    "amount_micros": 700000,
    "currency": "USD"
  },
  "interaction_metadata": {
    "source": "agent_action"
  },
  "ts": "2026-03-27T18:22:20Z"
}
