{
  "event_type": "interaction_started",
  "serve_token": "stk_abcxyz123",
  "session_id": "sess_001",
  "platform_id": "openai_chat",
  "agent_id": "brand_agent_123",
  "wallet_id": "wallet_890",
  "settlement": {
    "unit": "CPC",
    "amount_micros": 450000,
    "currency": "USD"
  },
  "interaction_metadata": {
    "source": "button",
    "position": 1
  },
  "ts": "2026-03-27T18:22:20Z"
}
